{
  "artifact_id": "0d550cab46a0711bed766acd4ebb9f1ee1ca55f872978b2cf55266cab25f5d92",
  "captured_at": "2026-06-07T06:00:00Z",
  "compile_target": "langgraph",
  "control_refs": [
    "control.crypto_policy_inventory@v1",
    "control.secret_injection_env_only@v1"
  ],
  "execution_id": "langgraph:vuln_intake_example_0001",
  "owner": {
    "assigned_at": "2026-01-15",
    "role": "platform-security-wg"
  },
  "provenance": {
    "captured_at": "2026-06-07T06:00:00Z",
    "source_url": "https://example.org/runs/vuln_intake_example_0001"
  },
  "regulation_refs": [
    "nis2:art-21-2-h"
  ],
  "retention": "P1Y",
  "schema_version": "1.0.0",
  "secret_handling": {
    "env_var_refs": [
      "CVE_FEED_API_TOKEN",
      "EPSS_FEED_API_TOKEN",
      "RISK_SUMMARY_LLM_API_KEY"
    ],
    "injection_mode": "env",
    "secret_count": 3,
    "secrets_baked_in": false
  },
  "stream": "crypto-attestation",
  "workflow_id": "vulnerability_triage"
}
