{
  "artifact_id": "9ed3f9d382c71f73b7d4cacd43faeb54c7a6048414448099e00ad8a2e26e5066",
  "captured_at": "2026-06-07T06:00:00Z",
  "compile_target": "n8n",
  "control_refs": [
    "control.crypto_policy_inventory@v1",
    "control.secret_injection_env_only@v1"
  ],
  "execution_id": "n8n:vuln_intake_example_0001",
  "owner": {
    "assigned_at": "2026-01-15",
    "role": "platform-security-wg"
  },
  "provenance": {
    "captured_at": "2026-06-07T06:00:00Z",
    "source_url": "https://example.org/runs/vuln_intake_example_0001"
  },
  "regulation_refs": [
    "nis2:art-21-2-h"
  ],
  "retention": "P1Y",
  "schema_version": "1.0.0",
  "secret_handling": {
    "env_var_refs": [
      "CVE_FEED_API_TOKEN",
      "EPSS_FEED_API_TOKEN",
      "RISK_SUMMARY_LLM_API_KEY"
    ],
    "injection_mode": "env",
    "secret_count": 3,
    "secrets_baked_in": false
  },
  "stream": "crypto-attestation",
  "workflow_id": "vulnerability_triage"
}
